{
  "eventId": "a1f2c3d4-1111-4222-8333-444455556666",
  "eventType": "trip.completed",
  "schemaVersion": 1,
  "occurredAt": "2026-09-29T10:00:00Z",
  "producer": "dispatch-service",
  "correlationId": "b1f2c3d4-1111-4222-8333-444455556666",
  "payload": {
    "tripId": "c1f2c3d4-1111-4222-8333-444455556666",
    "passengerId": "d1f2c3d4-1111-4222-8333-444455556666",
    "driverId": "e1f2c3d4-1111-4222-8333-444455556666",
    "fare": {"amount": 25000, "currency": "VND"},
    "completedAt": "2026-09-29T10:00:00Z"
  }
}
